{"id":"Cvm1PrqzZmHtkFsRw6cyu","iteration":32,"timestamp":"2026-04-22T11:57:16.000Z","hypothesis":{"id":"LAROz7FDN-IlRD7srK6of","type":"metafield_update","productId":"gid://shopify/Product/8234567891","productTitle":"Summit Trail Boots","field":"metafield","before":"650","after":"590","description":"Demo: metafield_update on Summit Trail Boots","reasoning":"Demo hypothesis generated by scripts/generate-demo-log.ts","queryFailurePatterns":["waterproof","category","specs"],"predictedEffect":"more matches on category + attribute queries","riskLevel":"low","confidence":"medium","estimatedImpact":"+3","promptVersion":"hypothesis.v1","metafieldNamespace":"custom","metafieldKey":"demo_field","metafieldType":"single_line_text_field"},"verdict":"reverted","scoreBefore":77,"scoreAfter":77,"scoreDelta":0,"confidence":0,"confidenceLevel":"noise","durationMs":20206,"costEstimateUsd":0.0629,"applyResult":{"hypothesisId":"LAROz7FDN-IlRD7srK6of","type":"metafield_update","productId":"gid://shopify/Product/8234567891","changes":[{"field":"metafield:custom.weight_grams","oldValue":"650","newValue":"590"}],"response":{"dryRun":false,"demo":true},"appliedAt":"2026-04-22T11:57:14.000Z","metafieldNamespace":"custom","metafieldKey":"demo_field","metafieldType":"single_line_text_field"},"revertResult":{"hypothesisId":"LAROz7FDN-IlRD7srK6of","productId":"gid://shopify/Product/8234567891","restoredChanges":[{"field":"metafield:custom.weight_grams","oldValue":"590","newValue":"650"}],"response":{"dryRun":false,"demo":true},"revertedAt":"2026-04-22T11:57:17.500Z"}}
{"id":"HZyIowOyQ4vGyxtWssQmi","iteration":33,"timestamp":"2026-04-22T11:57:44.000Z","hypothesis":{"id":"35lnQQQDRQzIEtZ2s-r2J","type":"description_restructure","productId":"gid://shopify/Product/8234567892","productTitle":"Alpine Down Vest","field":"descriptionHtml","before":"<p>Outdoor gear for everyday adventures.</p>","after":"<p>Built for the trail. Tested in the rain.</p>","description":"Demo: description_restructure on Alpine Down Vest","reasoning":"Demo hypothesis generated by scripts/generate-demo-log.ts","queryFailurePatterns":["waterproof","category","specs"],"predictedEffect":"more matches on category + attribute queries","riskLevel":"low","confidence":"medium","estimatedImpact":"+3","promptVersion":"hypothesis.v1"},"verdict":"reverted","scoreBefore":77,"scoreAfter":77,"scoreDelta":0,"confidence":0,"confidenceLevel":"noise","durationMs":22000,"costEstimateUsd":0.0734,"applyResult":{"hypothesisId":"35lnQQQDRQzIEtZ2s-r2J","type":"description_restructure","productId":"gid://shopify/Product/8234567892","changes":[{"field":"descriptionHtml","oldValue":"<p>Outdoor gear for everyday adventures.</p>","newValue":"<p>Built for the trail. Tested in the rain.</p>"}],"response":{"dryRun":false,"demo":true},"appliedAt":"2026-04-22T11:57:42.000Z"},"revertResult":{"hypothesisId":"35lnQQQDRQzIEtZ2s-r2J","productId":"gid://shopify/Product/8234567892","restoredChanges":[{"field":"descriptionHtml","oldValue":"<p>Built for the trail. Tested in the rain.</p>","newValue":"<p>Outdoor gear for everyday adventures.</p>"}],"response":{"dryRun":false,"demo":true},"revertedAt":"2026-04-22T11:57:45.500Z"}}
{"id":"Z75Zhx8XUQCjJE7JB6rV2","iteration":34,"timestamp":"2026-04-22T11:58:12.000Z","hypothesis":{"id":"CKAnnX8fYoRxl_DSLUl_m","type":"tags_update","productId":"gid://shopify/Product/8234567893","productTitle":"Ridgeline Backpack 45L","field":"tags","before":"outdoor, hiking","after":"waterproof, 3-layer, pit-zips, breathable","description":"Demo: tags_update on Ridgeline Backpack 45L","reasoning":"Demo hypothesis generated by scripts/generate-demo-log.ts","queryFailurePatterns":["waterproof","category","specs"],"predictedEffect":"more matches on category + attribute queries","riskLevel":"low","confidence":"medium","estimatedImpact":"+3","promptVersion":"hypothesis.v1"},"verdict":"reverted","scoreBefore":77,"scoreAfter":77,"scoreDelta":0,"confidence":0,"confidenceLevel":"noise","durationMs":20116,"costEstimateUsd":0.056,"applyResult":{"hypothesisId":"CKAnnX8fYoRxl_DSLUl_m","type":"tags_update","productId":"gid://shopify/Product/8234567893","changes":[{"field":"tags","oldValue":"outdoor, hiking","newValue":"waterproof, 3-layer, pit-zips, breathable"}],"response":{"dryRun":false,"demo":true},"appliedAt":"2026-04-22T11:58:10.000Z"},"revertResult":{"hypothesisId":"CKAnnX8fYoRxl_DSLUl_m","productId":"gid://shopify/Product/8234567893","restoredChanges":[{"field":"tags","oldValue":"waterproof, 3-layer, pit-zips, breathable","newValue":"outdoor, hiking"}],"response":{"dryRun":false,"demo":true},"revertedAt":"2026-04-22T11:58:13.500Z"}}
{"id":"9FKI7OPhENVRpgnPshPgz","iteration":35,"timestamp":"2026-04-22T11:58:40.000Z","hypothesis":{"id":"d-_pXp59tBKq7D9IzTQWp","type":"metafield_add","productId":"gid://shopify/Product/8234567894","productTitle":"Glacier Camp Stove","field":"metafield","before":"","after":"850","description":"Demo: metafield_add on Glacier Camp Stove","reasoning":"Demo hypothesis generated by scripts/generate-demo-log.ts","queryFailurePatterns":["waterproof","category","specs"],"predictedEffect":"more matches on category + attribute queries","riskLevel":"low","confidence":"medium","estimatedImpact":"+3","promptVersion":"hypothesis.v1","metafieldNamespace":"custom","metafieldKey":"demo_field","metafieldType":"single_line_text_field"},"verdict":"reverted","scoreBefore":77,"scoreAfter":76,"scoreDelta":-1,"confidence":1,"confidenceLevel":"noise","durationMs":19713,"costEstimateUsd":0.0861,"applyResult":{"hypothesisId":"d-_pXp59tBKq7D9IzTQWp","type":"metafield_add","productId":"gid://shopify/Product/8234567894","changes":[{"field":"metafield:custom.fill_power","oldValue":"","newValue":"850"}],"response":{"dryRun":false,"demo":true},"appliedAt":"2026-04-22T11:58:38.000Z","metafieldNamespace":"custom","metafieldKey":"demo_field","metafieldType":"single_line_text_field"},"revertResult":{"hypothesisId":"d-_pXp59tBKq7D9IzTQWp","productId":"gid://shopify/Product/8234567894","restoredChanges":[{"field":"metafield:custom.fill_power","oldValue":"850","newValue":""}],"response":{"dryRun":false,"demo":true},"revertedAt":"2026-04-22T11:58:41.500Z"}}
{"id":"n-qiKvxpCosD-CVJmnYBU","iteration":36,"timestamp":"2026-04-22T11:59:08.000Z","hypothesis":{"id":"B78MkCH6cHDV7URLzkeDH","type":"seo_title","productId":"gid://shopify/Product/8234567895","productTitle":"Cascade Trail Runners","field":"seo.title","before":"Cascade Trail Runners | Northwest Outfitters","after":"Cascade Trail Runners — Best Waterproof Hiking Jacket Premium Quality 2026","description":"Demo: seo_title on Cascade Trail Runners","reasoning":"Demo hypothesis generated by scripts/generate-demo-log.ts","queryFailurePatterns":["waterproof","category","specs"],"predictedEffect":"more matches on category + attribute queries","riskLevel":"low","confidence":"medium","estimatedImpact":"+3","promptVersion":"hypothesis.v1"},"verdict":"checks_failed","scoreBefore":76,"scoreAfter":76,"scoreDelta":0,"confidence":0,"confidenceLevel":"noise","durationMs":410,"costEstimateUsd":0.012,"failures":["seo_title_keyword_repeated_too_many_times"]}
{"id":"yXGg2sqqyeS8S210AnZEn","iteration":37,"timestamp":"2026-04-22T11:59:36.000Z","hypothesis":{"id":"zTKzf8oYrDSLsXl9G-JRK","type":"seo_description","productId":"gid://shopify/Product/8234567896","productTitle":"Storm Shell Pants","field":"seo.description","before":"Quality outdoor gear for every adventure.","after":"3-layer waterproof shell with sealed seams and pit zips. 10,000mm hydrostatic head, 20,000g/m²/24h breathability. Ideal for rainy day-hikes and shoulder-season backpacking.","description":"Demo: seo_description on Storm Shell Pants","reasoning":"Demo hypothesis generated by scripts/generate-demo-log.ts","queryFailurePatterns":["waterproof","category","specs"],"predictedEffect":"more matches on category + attribute queries","riskLevel":"low","confidence":"medium","estimatedImpact":"+3","promptVersion":"hypothesis.v1"},"verdict":"reverted","scoreBefore":76,"scoreAfter":76,"scoreDelta":0,"confidence":0,"confidenceLevel":"noise","durationMs":20574,"costEstimateUsd":0.1136,"applyResult":{"hypothesisId":"zTKzf8oYrDSLsXl9G-JRK","type":"seo_description","productId":"gid://shopify/Product/8234567896","changes":[{"field":"seo.description","oldValue":"Quality outdoor gear for every adventure.","newValue":"3-layer waterproof shell with sealed seams and pit zips. 10,000mm hydrostatic head, 20,000g/m²/24h breathability. Ideal for rainy day-hikes and shoulder-season backpacking."}],"response":{"dryRun":false,"demo":true},"appliedAt":"2026-04-22T11:59:34.000Z"},"revertResult":{"hypothesisId":"zTKzf8oYrDSLsXl9G-JRK","productId":"gid://shopify/Product/8234567896","restoredChanges":[{"field":"seo.description","oldValue":"3-layer waterproof shell with sealed seams and pit zips. 10,000mm hydrostatic head, 20,000g/m²/24h breathability. Ideal for rainy day-hikes and shoulder-season backpacking.","newValue":"Quality outdoor gear for every adventure."}],"response":{"dryRun":false,"demo":true},"revertedAt":"2026-04-22T11:59:37.500Z"}}
{"id":"tZG76fNuiyYWkD9mYHFGk","iteration":38,"timestamp":"2026-04-22T12:00:04.000Z","hypothesis":{"id":"j-DUWxLtsgs9XDpXL4o7J","type":"tags_update","productId":"gid://shopify/Product/8234567897","productTitle":"Mesa Sun Hoodie","field":"tags","before":"outdoor, hiking","after":"waterproof, 3-layer, pit-zips, breathable","description":"Demo: tags_update on Mesa Sun Hoodie","reasoning":"Demo hypothesis generated by scripts/generate-demo-log.ts","queryFailurePatterns":["waterproof","category","specs"],"predictedEffect":"more matches on category + attribute queries","riskLevel":"low","confidence":"medium","estimatedImpact":"+3","promptVersion":"hypothesis.v1"},"verdict":"reverted","scoreBefore":76,"scoreAfter":76,"scoreDelta":0,"confidence":0,"confidenceLevel":"noise","durationMs":19185,"costEstimateUsd":0.0776,"applyResult":{"hypothesisId":"j-DUWxLtsgs9XDpXL4o7J","type":"tags_update","productId":"gid://shopify/Product/8234567897","changes":[{"field":"tags","oldValue":"outdoor, hiking","newValue":"waterproof, 3-layer, pit-zips, breathable"}],"response":{"dryRun":false,"demo":true},"appliedAt":"2026-04-22T12:00:02.000Z"},"revertResult":{"hypothesisId":"j-DUWxLtsgs9XDpXL4o7J","productId":"gid://shopify/Product/8234567897","restoredChanges":[{"field":"tags","oldValue":"waterproof, 3-layer, pit-zips, breathable","newValue":"outdoor, hiking"}],"response":{"dryRun":false,"demo":true},"revertedAt":"2026-04-22T12:00:05.500Z"}}
{"id":"WjufbzPuTBLcOHAIZN5i9","iteration":39,"timestamp":"2026-04-22T12:00:32.000Z","hypothesis":{"id":"LaqtKSsisCh90GvfYBMr_","type":"seo_title","productId":"gid://shopify/Product/8234567898","productTitle":"Talus Sleeping Bag","field":"seo.title","before":"Talus Sleeping Bag | Northwest Outfitters","after":"Best Backpacking Stove 2026 | Glacier","description":"Demo: seo_title on Talus Sleeping Bag","reasoning":"Demo hypothesis generated by scripts/generate-demo-log.ts","queryFailurePatterns":["waterproof","category","specs"],"predictedEffect":"more matches on category + attribute queries","riskLevel":"low","confidence":"medium","estimatedImpact":"+3","promptVersion":"hypothesis.v1"},"verdict":"reverted","scoreBefore":76,"scoreAfter":76,"scoreDelta":0,"confidence":0,"confidenceLevel":"noise","durationMs":21855,"costEstimateUsd":0.1015,"applyResult":{"hypothesisId":"LaqtKSsisCh90GvfYBMr_","type":"seo_title","productId":"gid://shopify/Product/8234567898","changes":[{"field":"seo.title","oldValue":"Talus Sleeping Bag | Northwest Outfitters","newValue":"Best Backpacking Stove 2026 | Glacier"}],"response":{"dryRun":false,"demo":true},"appliedAt":"2026-04-22T12:00:30.000Z"},"revertResult":{"hypothesisId":"LaqtKSsisCh90GvfYBMr_","productId":"gid://shopify/Product/8234567898","restoredChanges":[{"field":"seo.title","oldValue":"Best Backpacking Stove 2026 | Glacier","newValue":"Talus Sleeping Bag | Northwest Outfitters"}],"response":{"dryRun":false,"demo":true},"revertedAt":"2026-04-22T12:00:33.500Z"}}
