{"id":"eLXpeZycanHFEDIjpPrDv","iteration":1,"timestamp":"2026-04-22T11:42:48.000Z","hypothesis":{"id":"SnQUcn7a7ENR9bXMQ7wCk","type":"title_rewrite","productId":"gid://shopify/Product/8234567890","productTitle":"Explorer Pro Jacket","field":"title","before":"Explorer Pro Jacket","after":"Explorer Pro Jacket — Waterproof Hiking Shell","description":"Demo: title_rewrite on Explorer Pro Jacket","reasoning":"Demo hypothesis generated by scripts/generate-demo-log.ts","queryFailurePatterns":["waterproof","category","specs"],"predictedEffect":"more matches on category + attribute queries","riskLevel":"low","confidence":"medium","estimatedImpact":"+3","promptVersion":"hypothesis.v1"},"verdict":"kept","scoreBefore":25,"scoreAfter":29,"scoreDelta":4,"confidence":4,"confidenceLevel":"medium","durationMs":21366,"costEstimateUsd":0.1137,"applyResult":{"hypothesisId":"SnQUcn7a7ENR9bXMQ7wCk","type":"title_rewrite","productId":"gid://shopify/Product/8234567890","changes":[{"field":"title","oldValue":"Explorer Pro Jacket","newValue":"Explorer Pro Jacket — Waterproof Hiking Shell"}],"response":{"dryRun":false,"demo":true},"appliedAt":"2026-04-22T11:42:46.000Z"}}
{"id":"XEPmldKevcjP3HlXGcI0U","iteration":2,"timestamp":"2026-04-22T11:43:16.000Z","hypothesis":{"id":"rODckpogn7zqaUereK7P7","type":"seo_title","productId":"gid://shopify/Product/8234567891","productTitle":"Summit Trail Boots","field":"seo.title","before":"Summit Trail Boots | Northwest Outfitters","after":"Waterproof Hiking Jacket | Explorer Pro","description":"Demo: seo_title on Summit Trail Boots","reasoning":"Demo hypothesis generated by scripts/generate-demo-log.ts","queryFailurePatterns":["waterproof","category","specs"],"predictedEffect":"more matches on category + attribute queries","riskLevel":"low","confidence":"medium","estimatedImpact":"+3","promptVersion":"hypothesis.v1"},"verdict":"kept","scoreBefore":29,"scoreAfter":31,"scoreDelta":2,"confidence":2,"confidenceLevel":"low","durationMs":21637,"costEstimateUsd":0.0446,"applyResult":{"hypothesisId":"rODckpogn7zqaUereK7P7","type":"seo_title","productId":"gid://shopify/Product/8234567891","changes":[{"field":"seo.title","oldValue":"Summit Trail Boots | Northwest Outfitters","newValue":"Waterproof Hiking Jacket | Explorer Pro"}],"response":{"dryRun":false,"demo":true},"appliedAt":"2026-04-22T11:43:14.000Z"}}
{"id":"zXhrxM3WCq3E3PRLT4yUz","iteration":3,"timestamp":"2026-04-22T11:43:44.000Z","hypothesis":{"id":"66gO2NE-gCyt5FnKrVuuU","type":"metafield_add","productId":"gid://shopify/Product/8234567892","productTitle":"Alpine Down Vest","field":"metafield","before":"","after":"10000","description":"Demo: metafield_add on Alpine Down Vest","reasoning":"Demo hypothesis generated by scripts/generate-demo-log.ts","queryFailurePatterns":["waterproof","category","specs"],"predictedEffect":"more matches on category + attribute queries","riskLevel":"low","confidence":"medium","estimatedImpact":"+3","promptVersion":"hypothesis.v1","metafieldNamespace":"custom","metafieldKey":"demo_field","metafieldType":"single_line_text_field"},"verdict":"reverted","scoreBefore":31,"scoreAfter":29,"scoreDelta":-2,"confidence":2,"confidenceLevel":"low","durationMs":18564,"costEstimateUsd":0.0847,"applyResult":{"hypothesisId":"66gO2NE-gCyt5FnKrVuuU","type":"metafield_add","productId":"gid://shopify/Product/8234567892","changes":[{"field":"metafield:custom.waterproof_rating_mm","oldValue":"","newValue":"10000"}],"response":{"dryRun":false,"demo":true},"appliedAt":"2026-04-22T11:43:42.000Z","metafieldNamespace":"custom","metafieldKey":"demo_field","metafieldType":"single_line_text_field"},"revertResult":{"hypothesisId":"66gO2NE-gCyt5FnKrVuuU","productId":"gid://shopify/Product/8234567892","restoredChanges":[{"field":"metafield:custom.waterproof_rating_mm","oldValue":"10000","newValue":""}],"response":{"dryRun":false,"demo":true},"revertedAt":"2026-04-22T11:43:45.500Z"}}
{"id":"R0sMYBfBYID9M_Eh70Zss","iteration":4,"timestamp":"2026-04-22T11:44:12.000Z","hypothesis":{"id":"jhbkzglZgfPWeyNOzV2B6","type":"title_rewrite","productId":"gid://shopify/Product/8234567893","productTitle":"Ridgeline Backpack 45L","field":"title","before":"Ridgeline Backpack 45L","after":"Summit Trail Boots — Waterproof Lightweight Hiking Footwear","description":"Demo: title_rewrite on Ridgeline Backpack 45L","reasoning":"Demo hypothesis generated by scripts/generate-demo-log.ts","queryFailurePatterns":["waterproof","category","specs"],"predictedEffect":"more matches on category + attribute queries","riskLevel":"low","confidence":"medium","estimatedImpact":"+3","promptVersion":"hypothesis.v1"},"verdict":"kept","scoreBefore":29,"scoreAfter":34,"scoreDelta":5,"confidence":5,"confidenceLevel":"medium","durationMs":21027,"costEstimateUsd":0.0699,"applyResult":{"hypothesisId":"jhbkzglZgfPWeyNOzV2B6","type":"title_rewrite","productId":"gid://shopify/Product/8234567893","changes":[{"field":"title","oldValue":"Ridgeline Backpack 45L","newValue":"Summit Trail Boots — Waterproof Lightweight Hiking Footwear"}],"response":{"dryRun":false,"demo":true},"appliedAt":"2026-04-22T11:44:10.000Z"}}
{"id":"PujL6Yz9fCQPOgKO8FIaj","iteration":5,"timestamp":"2026-04-22T11:44:40.000Z","hypothesis":{"id":"ddgMRPxj25CpFMZ7VH-Bi","type":"description_restructure","productId":"gid://shopify/Product/8234567894","productTitle":"Glacier Camp Stove","field":"descriptionHtml","before":"<p>Outdoor gear for everyday adventures.</p>","after":"<p>Lightweight rain shell. Built for fast hikes. Packs to fist size. Waterproof and breathable. Trail-ready in any weather.</p>","description":"Demo: description_restructure on Glacier Camp Stove","reasoning":"Demo hypothesis generated by scripts/generate-demo-log.ts","queryFailurePatterns":["waterproof","category","specs"],"predictedEffect":"more matches on category + attribute queries","riskLevel":"low","confidence":"medium","estimatedImpact":"+3","promptVersion":"hypothesis.v1"},"verdict":"kept","scoreBefore":34,"scoreAfter":37,"scoreDelta":3,"confidence":3,"confidenceLevel":"medium","durationMs":21836,"costEstimateUsd":0.0763,"applyResult":{"hypothesisId":"ddgMRPxj25CpFMZ7VH-Bi","type":"description_restructure","productId":"gid://shopify/Product/8234567894","changes":[{"field":"descriptionHtml","oldValue":"<p>Outdoor gear for everyday adventures.</p>","newValue":"<p>Lightweight rain shell. Built for fast hikes. Packs to fist size. Waterproof and breathable. Trail-ready in any weather.</p>"}],"response":{"dryRun":false,"demo":true},"appliedAt":"2026-04-22T11:44:38.000Z"}}
{"id":"gx_2dCLmkUVO5Y0dShHGa","iteration":6,"timestamp":"2026-04-22T11:45:08.000Z","hypothesis":{"id":"lsiCtR88WL5M_MfxVuKHS","type":"seo_description","productId":"gid://shopify/Product/8234567895","productTitle":"Cascade Trail Runners","field":"seo.description","before":"Quality outdoor gear for every adventure.","after":"3-layer waterproof shell with sealed seams and pit zips. 10,000mm hydrostatic head, 20,000g/m²/24h breathability. Ideal for rainy day-hikes and shoulder-season backpacking.","description":"Demo: seo_description on Cascade Trail Runners","reasoning":"Demo hypothesis generated by scripts/generate-demo-log.ts","queryFailurePatterns":["waterproof","category","specs"],"predictedEffect":"more matches on category + attribute queries","riskLevel":"low","confidence":"medium","estimatedImpact":"+3","promptVersion":"hypothesis.v1"},"verdict":"reverted","scoreBefore":37,"scoreAfter":36,"scoreDelta":-1,"confidence":1,"confidenceLevel":"noise","durationMs":19118,"costEstimateUsd":0.0901,"applyResult":{"hypothesisId":"lsiCtR88WL5M_MfxVuKHS","type":"seo_description","productId":"gid://shopify/Product/8234567895","changes":[{"field":"seo.description","oldValue":"Quality outdoor gear for every adventure.","newValue":"3-layer waterproof shell with sealed seams and pit zips. 10,000mm hydrostatic head, 20,000g/m²/24h breathability. Ideal for rainy day-hikes and shoulder-season backpacking."}],"response":{"dryRun":false,"demo":true},"appliedAt":"2026-04-22T11:45:06.000Z"},"revertResult":{"hypothesisId":"lsiCtR88WL5M_MfxVuKHS","productId":"gid://shopify/Product/8234567895","restoredChanges":[{"field":"seo.description","oldValue":"3-layer waterproof shell with sealed seams and pit zips. 10,000mm hydrostatic head, 20,000g/m²/24h breathability. Ideal for rainy day-hikes and shoulder-season backpacking.","newValue":"Quality outdoor gear for every adventure."}],"response":{"dryRun":false,"demo":true},"revertedAt":"2026-04-22T11:45:09.500Z"}}
{"id":"8zPzhhiSXR9y3K1_fCv58","iteration":7,"timestamp":"2026-04-22T11:45:36.000Z","hypothesis":{"id":"2GoQ4Wrs5Rs_gB8Qqyd4q","type":"metafield_add","productId":"gid://shopify/Product/8234567896","productTitle":"Storm Shell Pants","field":"metafield","before":"","after":"850","description":"Demo: metafield_add on Storm Shell Pants","reasoning":"Demo hypothesis generated by scripts/generate-demo-log.ts","queryFailurePatterns":["waterproof","category","specs"],"predictedEffect":"more matches on category + attribute queries","riskLevel":"low","confidence":"medium","estimatedImpact":"+3","promptVersion":"hypothesis.v1","metafieldNamespace":"custom","metafieldKey":"demo_field","metafieldType":"single_line_text_field"},"verdict":"kept","scoreBefore":36,"scoreAfter":43,"scoreDelta":7,"confidence":7,"confidenceLevel":"medium","durationMs":20628,"costEstimateUsd":0.0532,"applyResult":{"hypothesisId":"2GoQ4Wrs5Rs_gB8Qqyd4q","type":"metafield_add","productId":"gid://shopify/Product/8234567896","changes":[{"field":"metafield:custom.fill_power","oldValue":"","newValue":"850"}],"response":{"dryRun":false,"demo":true},"appliedAt":"2026-04-22T11:45:34.000Z","metafieldNamespace":"custom","metafieldKey":"demo_field","metafieldType":"single_line_text_field"}}
{"id":"ymnhqazbqQVjiK0PzUUmB","iteration":8,"timestamp":"2026-04-22T11:46:04.000Z","hypothesis":{"id":"cwC-RDLd4QHxg0CRtMnH-","type":"title_rewrite","productId":"gid://shopify/Product/8234567897","productTitle":"Mesa Sun Hoodie","field":"title","before":"Mesa Sun Hoodie","after":"Alpine Down Vest — Insulated Lightweight Outerwear for Cold Weather","description":"Demo: title_rewrite on Mesa Sun Hoodie","reasoning":"Demo hypothesis generated by scripts/generate-demo-log.ts","queryFailurePatterns":["waterproof","category","specs"],"predictedEffect":"more matches on category + attribute queries","riskLevel":"low","confidence":"medium","estimatedImpact":"+3","promptVersion":"hypothesis.v1"},"verdict":"kept","scoreBefore":43,"scoreAfter":48,"scoreDelta":5,"confidence":5,"confidenceLevel":"medium","durationMs":21957,"costEstimateUsd":0.0663,"applyResult":{"hypothesisId":"cwC-RDLd4QHxg0CRtMnH-","type":"title_rewrite","productId":"gid://shopify/Product/8234567897","changes":[{"field":"title","oldValue":"Mesa Sun Hoodie","newValue":"Alpine Down Vest — Insulated Lightweight Outerwear for Cold Weather"}],"response":{"dryRun":false,"demo":true},"appliedAt":"2026-04-22T11:46:02.000Z"}}
{"id":"nfGzIZwNHoJ9PxxvVbfYr","iteration":9,"timestamp":"2026-04-22T11:46:32.000Z","hypothesis":{"id":"a8otdO4Tl7JreWm80B5jH","type":"title_rewrite","productId":"gid://shopify/Product/8234567898","productTitle":"Talus Sleeping Bag","field":"title","before":"Talus Sleeping Bag","after":"Talus Sleeping Bag — BUY NOW BEST DEAL","description":"Demo: title_rewrite on Talus Sleeping Bag","reasoning":"Demo hypothesis generated by scripts/generate-demo-log.ts","queryFailurePatterns":["waterproof","category","specs"],"predictedEffect":"more matches on category + attribute queries","riskLevel":"low","confidence":"medium","estimatedImpact":"+3","promptVersion":"hypothesis.v1"},"verdict":"checks_failed","scoreBefore":48,"scoreAfter":48,"scoreDelta":0,"confidence":0,"confidenceLevel":"noise","durationMs":410,"costEstimateUsd":0.012,"failures":["title_starts_with_buy_shop_or_best","all_caps_word_too_long"]}
{"id":"JPNCHT5SdHq1OIflYOOsi","iteration":10,"timestamp":"2026-04-22T11:47:00.000Z","hypothesis":{"id":"kkSYu7AJMmotv9FHig_Eu","type":"description_restructure","productId":"gid://shopify/Product/8234567899","productTitle":"Vista Trekking Poles","field":"descriptionHtml","before":"<p>Outdoor gear for everyday adventures.</p>","after":"<p>Engineered for serious backcountry travel, this multi-day pack distributes weight evenly across hip and shoulder. Ventilated suspension keeps your back cool through long approaches and humid mornings on the trail.</p>","description":"Demo: description_restructure on Vista Trekking Poles","reasoning":"Demo hypothesis generated by scripts/generate-demo-log.ts","queryFailurePatterns":["waterproof","category","specs"],"predictedEffect":"more matches on category + attribute queries","riskLevel":"low","confidence":"medium","estimatedImpact":"+3","promptVersion":"hypothesis.v1"},"verdict":"kept","scoreBefore":48,"scoreAfter":52,"scoreDelta":4,"confidence":4,"confidenceLevel":"medium","durationMs":20176,"costEstimateUsd":0.1177,"applyResult":{"hypothesisId":"kkSYu7AJMmotv9FHig_Eu","type":"description_restructure","productId":"gid://shopify/Product/8234567899","changes":[{"field":"descriptionHtml","oldValue":"<p>Outdoor gear for everyday adventures.</p>","newValue":"<p>Engineered for serious backcountry travel, this multi-day pack distributes weight evenly across hip and shoulder. Ventilated suspension keeps your back cool through long approaches and humid mornings on the trail.</p>"}],"response":{"dryRun":false,"demo":true},"appliedAt":"2026-04-22T11:46:58.000Z"}}
{"id":"8nTXeN_rohOnAWClzIiWf","iteration":11,"timestamp":"2026-04-22T11:47:28.000Z","hypothesis":{"id":"kD7IEBC8V2g7Dx_macdNO","type":"tags_update","productId":"gid://shopify/Product/8234567890","productTitle":"Explorer Pro Jacket","field":"tags","before":"outdoor, hiking","after":"waterproof, 3-layer, pit-zips, breathable","description":"Demo: tags_update on Explorer Pro Jacket","reasoning":"Demo hypothesis generated by scripts/generate-demo-log.ts","queryFailurePatterns":["waterproof","category","specs"],"predictedEffect":"more matches on category + attribute queries","riskLevel":"low","confidence":"medium","estimatedImpact":"+3","promptVersion":"hypothesis.v1"},"verdict":"reverted","scoreBefore":52,"scoreAfter":51,"scoreDelta":-1,"confidence":1,"confidenceLevel":"noise","durationMs":22000,"costEstimateUsd":0.1057,"applyResult":{"hypothesisId":"kD7IEBC8V2g7Dx_macdNO","type":"tags_update","productId":"gid://shopify/Product/8234567890","changes":[{"field":"tags","oldValue":"outdoor, hiking","newValue":"waterproof, 3-layer, pit-zips, breathable"}],"response":{"dryRun":false,"demo":true},"appliedAt":"2026-04-22T11:47:26.000Z"},"revertResult":{"hypothesisId":"kD7IEBC8V2g7Dx_macdNO","productId":"gid://shopify/Product/8234567890","restoredChanges":[{"field":"tags","oldValue":"waterproof, 3-layer, pit-zips, breathable","newValue":"outdoor, hiking"}],"response":{"dryRun":false,"demo":true},"revertedAt":"2026-04-22T11:47:29.500Z"}}
{"id":"_Y57YDNu1SbkbPU8Th8Ha","iteration":12,"timestamp":"2026-04-22T11:47:56.000Z","hypothesis":{"id":"ZsXz9GLB6iapFS1wJYcux","type":"seo_title","productId":"gid://shopify/Product/8234567891","productTitle":"Summit Trail Boots","field":"seo.title","before":"Summit Trail Boots | Northwest Outfitters","after":"Lightweight Trail Running Shoes | Cascade","description":"Demo: seo_title on Summit Trail Boots","reasoning":"Demo hypothesis generated by scripts/generate-demo-log.ts","queryFailurePatterns":["waterproof","category","specs"],"predictedEffect":"more matches on category + attribute queries","riskLevel":"low","confidence":"medium","estimatedImpact":"+3","promptVersion":"hypothesis.v1"},"verdict":"kept","scoreBefore":51,"scoreAfter":54,"scoreDelta":3,"confidence":3,"confidenceLevel":"medium","durationMs":20146,"costEstimateUsd":0.0543,"applyResult":{"hypothesisId":"ZsXz9GLB6iapFS1wJYcux","type":"seo_title","productId":"gid://shopify/Product/8234567891","changes":[{"field":"seo.title","oldValue":"Summit Trail Boots | Northwest Outfitters","newValue":"Lightweight Trail Running Shoes | Cascade"}],"response":{"dryRun":false,"demo":true},"appliedAt":"2026-04-22T11:47:54.000Z"}}
{"id":"ixHsy75R_OI9LYT2cTEv8","iteration":13,"timestamp":"2026-04-22T11:48:24.000Z","hypothesis":{"id":"KX18BpCAp6JI3XuYxRXA4","type":"title_rewrite","productId":"gid://shopify/Product/8234567892","productTitle":"Alpine Down Vest","field":"title","before":"Alpine Down Vest","after":"Ridgeline Backpack 45L — Waterproof Multi-Day Trekking and Camping Pack","description":"Demo: title_rewrite on Alpine Down Vest","reasoning":"Demo hypothesis generated by scripts/generate-demo-log.ts","queryFailurePatterns":["waterproof","category","specs"],"predictedEffect":"more matches on category + attribute queries","riskLevel":"low","confidence":"medium","estimatedImpact":"+3","promptVersion":"hypothesis.v1"},"verdict":"kept","scoreBefore":54,"scoreAfter":60,"scoreDelta":6,"confidence":6,"confidenceLevel":"medium","durationMs":19681,"costEstimateUsd":0.1196,"applyResult":{"hypothesisId":"KX18BpCAp6JI3XuYxRXA4","type":"title_rewrite","productId":"gid://shopify/Product/8234567892","changes":[{"field":"title","oldValue":"Alpine Down Vest","newValue":"Ridgeline Backpack 45L — Waterproof Multi-Day Trekking and Camping Pack"}],"response":{"dryRun":false,"demo":true},"appliedAt":"2026-04-22T11:48:22.000Z"}}
{"id":"2bRY-quZQKFhIbZbrK2Z9","iteration":14,"timestamp":"2026-04-22T11:48:52.000Z","hypothesis":{"id":"8-mj9kIybyitHOnahU-bM","type":"metafield_add","productId":"gid://shopify/Product/8234567893","productTitle":"Ridgeline Backpack 45L","field":"metafield","before":"","after":"850","description":"Demo: metafield_add on Ridgeline Backpack 45L","reasoning":"Demo hypothesis generated by scripts/generate-demo-log.ts","queryFailurePatterns":["waterproof","category","specs"],"predictedEffect":"more matches on category + attribute queries","riskLevel":"low","confidence":"medium","estimatedImpact":"+3","promptVersion":"hypothesis.v1","metafieldNamespace":"custom","metafieldKey":"demo_field","metafieldType":"single_line_text_field"},"verdict":"kept","scoreBefore":60,"scoreAfter":66,"scoreDelta":6,"confidence":6,"confidenceLevel":"medium","durationMs":21962,"costEstimateUsd":0.1053,"applyResult":{"hypothesisId":"8-mj9kIybyitHOnahU-bM","type":"metafield_add","productId":"gid://shopify/Product/8234567893","changes":[{"field":"metafield:custom.fill_power","oldValue":"","newValue":"850"}],"response":{"dryRun":false,"demo":true},"appliedAt":"2026-04-22T11:48:50.000Z","metafieldNamespace":"custom","metafieldKey":"demo_field","metafieldType":"single_line_text_field"}}
{"id":"ee0Te56NF9fjEZnw8UjsN","iteration":15,"timestamp":"2026-04-22T11:49:20.000Z","hypothesis":{"id":"cMSxaiZLNDJTwtDOQ6N8c","type":"seo_description","productId":"gid://shopify/Product/8234567894","productTitle":"Glacier Camp Stove","field":"seo.description","before":"Quality outdoor gear for every adventure.","after":"3-layer waterproof shell with sealed seams and pit zips. 10,000mm hydrostatic head, 20,000g/m²/24h breathability. Ideal for rainy day-hikes and shoulder-season backpacking.","description":"Demo: seo_description on Glacier Camp Stove","reasoning":"Demo hypothesis generated by scripts/generate-demo-log.ts","queryFailurePatterns":["waterproof","category","specs"],"predictedEffect":"more matches on category + attribute queries","riskLevel":"low","confidence":"medium","estimatedImpact":"+3","promptVersion":"hypothesis.v1"},"verdict":"kept","scoreBefore":66,"scoreAfter":68,"scoreDelta":2,"confidence":2,"confidenceLevel":"low","durationMs":20601,"costEstimateUsd":0.0753,"applyResult":{"hypothesisId":"cMSxaiZLNDJTwtDOQ6N8c","type":"seo_description","productId":"gid://shopify/Product/8234567894","changes":[{"field":"seo.description","oldValue":"Quality outdoor gear for every adventure.","newValue":"3-layer waterproof shell with sealed seams and pit zips. 10,000mm hydrostatic head, 20,000g/m²/24h breathability. Ideal for rainy day-hikes and shoulder-season backpacking."}],"response":{"dryRun":false,"demo":true},"appliedAt":"2026-04-22T11:49:18.000Z"}}
{"id":"fHPc8Osz4yF4FshLddcrr","iteration":16,"timestamp":"2026-04-22T11:49:48.000Z","hypothesis":{"id":"LbF7ce--mSRzRHNj2ZeXH","type":"description_restructure","productId":"gid://shopify/Product/8234567895","productTitle":"Cascade Trail Runners","field":"descriptionHtml","before":"<p>Outdoor gear for everyday adventures.</p>","after":"<p>Designed for serious backcountry weather, this technical shell pairs a three-layer waterproof membrane with reinforced shoulder panels. The panels survive heavy pack straps over multi-day alpine approaches and resist abrasion from rope work.</p>","description":"Demo: description_restructure on Cascade Trail Runners","reasoning":"Demo hypothesis generated by scripts/generate-demo-log.ts","queryFailurePatterns":["waterproof","category","specs"],"predictedEffect":"more matches on category + attribute queries","riskLevel":"low","confidence":"medium","estimatedImpact":"+3","promptVersion":"hypothesis.v1"},"verdict":"kept","scoreBefore":68,"scoreAfter":73,"scoreDelta":5,"confidence":5,"confidenceLevel":"medium","durationMs":19152,"costEstimateUsd":0.1142,"applyResult":{"hypothesisId":"LbF7ce--mSRzRHNj2ZeXH","type":"description_restructure","productId":"gid://shopify/Product/8234567895","changes":[{"field":"descriptionHtml","oldValue":"<p>Outdoor gear for everyday adventures.</p>","newValue":"<p>Designed for serious backcountry weather, this technical shell pairs a three-layer waterproof membrane with reinforced shoulder panels. The panels survive heavy pack straps over multi-day alpine approaches and resist abrasion from rope work.</p>"}],"response":{"dryRun":false,"demo":true},"appliedAt":"2026-04-22T11:49:46.000Z"}}
