{"id":"mGgzxWHbVwnqTol5YxJKw","iteration":17,"timestamp":"2026-04-22T11:50:16.000Z","hypothesis":{"id":"x-NxSR5KiNKJfSFzXb1bH","type":"metafield_update","productId":"gid://shopify/Product/8234567896","productTitle":"Storm Shell Pants","field":"metafield","before":"650","after":"590","description":"Demo: metafield_update on Storm Shell Pants","reasoning":"Demo hypothesis generated by scripts/generate-demo-log.ts","queryFailurePatterns":["waterproof","category","specs"],"predictedEffect":"more matches on category + attribute queries","riskLevel":"low","confidence":"medium","estimatedImpact":"+3","promptVersion":"hypothesis.v1","metafieldNamespace":"custom","metafieldKey":"demo_field","metafieldType":"single_line_text_field"},"verdict":"reverted","scoreBefore":73,"scoreAfter":72,"scoreDelta":-1,"confidence":1,"confidenceLevel":"noise","durationMs":21846,"costEstimateUsd":0.0747,"applyResult":{"hypothesisId":"x-NxSR5KiNKJfSFzXb1bH","type":"metafield_update","productId":"gid://shopify/Product/8234567896","changes":[{"field":"metafield:custom.weight_grams","oldValue":"650","newValue":"590"}],"response":{"dryRun":false,"demo":true},"appliedAt":"2026-04-22T11:50:14.000Z","metafieldNamespace":"custom","metafieldKey":"demo_field","metafieldType":"single_line_text_field"},"revertResult":{"hypothesisId":"x-NxSR5KiNKJfSFzXb1bH","productId":"gid://shopify/Product/8234567896","restoredChanges":[{"field":"metafield:custom.weight_grams","oldValue":"590","newValue":"650"}],"response":{"dryRun":false,"demo":true},"revertedAt":"2026-04-22T11:50:17.500Z"}}
{"id":"W-fyFdi7sCG3gfI_KflNF","iteration":18,"timestamp":"2026-04-22T11:50:44.000Z","hypothesis":{"id":"4RbZYe4xqLEWmEgu4g3AB","type":"description_restructure","productId":"gid://shopify/Product/8234567897","productTitle":"Mesa Sun Hoodie","field":"descriptionHtml","before":"","after":"","description":"Demo: description_restructure on Mesa Sun Hoodie","reasoning":"Demo hypothesis generated by scripts/generate-demo-log.ts","queryFailurePatterns":["waterproof","category","specs"],"predictedEffect":"more matches on category + attribute queries","riskLevel":"low","confidence":"medium","estimatedImpact":"+3","promptVersion":"hypothesis.v1"},"verdict":"generator_failed","scoreBefore":72,"scoreAfter":72,"scoreDelta":0,"confidence":0,"confidenceLevel":"noise","durationMs":1240,"costEstimateUsd":0.018,"error":"Anthropic returned malformed JSON for hypothesis proposal (retry budget exhausted)."}
{"id":"pBH7RDo_Q5pe70cf2oBzh","iteration":19,"timestamp":"2026-04-22T11:51:12.000Z","hypothesis":{"id":"w-XbzTBK4-t0ZxxbsfS5F","type":"title_rewrite","productId":"gid://shopify/Product/8234567898","productTitle":"Talus Sleeping Bag","field":"title","before":"Talus Sleeping Bag","after":"Talus Sleeping Bag — Lightweight Outdoor Gear","description":"Demo: title_rewrite on Talus Sleeping Bag","reasoning":"Demo hypothesis generated by scripts/generate-demo-log.ts","queryFailurePatterns":["waterproof","category","specs"],"predictedEffect":"more matches on category + attribute queries","riskLevel":"low","confidence":"medium","estimatedImpact":"+3","promptVersion":"hypothesis.v1"},"verdict":"reverted","scoreBefore":72,"scoreAfter":71,"scoreDelta":-1,"confidence":1,"confidenceLevel":"noise","durationMs":18600,"costEstimateUsd":0.0658,"applyResult":{"hypothesisId":"w-XbzTBK4-t0ZxxbsfS5F","type":"title_rewrite","productId":"gid://shopify/Product/8234567898","changes":[{"field":"title","oldValue":"Talus Sleeping Bag","newValue":"Talus Sleeping Bag — Lightweight Outdoor Gear"}],"response":{"dryRun":false,"demo":true},"appliedAt":"2026-04-22T11:51:10.000Z"},"revertResult":{"hypothesisId":"w-XbzTBK4-t0ZxxbsfS5F","productId":"gid://shopify/Product/8234567898","restoredChanges":[{"field":"title","oldValue":"Talus Sleeping Bag — Lightweight Outdoor Gear","newValue":"Talus Sleeping Bag"}],"response":{"dryRun":false,"demo":true},"revertedAt":"2026-04-22T11:51:13.500Z"}}
{"id":"5I3kg0bkk2UrMv2dkJCzN","iteration":20,"timestamp":"2026-04-22T11:51:40.000Z","hypothesis":{"id":"8G8yF_x-t3wDIWCayXpxT","type":"seo_title","productId":"gid://shopify/Product/8234567899","productTitle":"Vista Trekking Poles","field":"seo.title","before":"Vista Trekking Poles | Northwest Outfitters","after":"Best Backpacking Stove 2026 | Glacier","description":"Demo: seo_title on Vista Trekking Poles","reasoning":"Demo hypothesis generated by scripts/generate-demo-log.ts","queryFailurePatterns":["waterproof","category","specs"],"predictedEffect":"more matches on category + attribute queries","riskLevel":"low","confidence":"medium","estimatedImpact":"+3","promptVersion":"hypothesis.v1"},"verdict":"kept","scoreBefore":71,"scoreAfter":73,"scoreDelta":2,"confidence":2,"confidenceLevel":"low","durationMs":21652,"costEstimateUsd":0.1008,"applyResult":{"hypothesisId":"8G8yF_x-t3wDIWCayXpxT","type":"seo_title","productId":"gid://shopify/Product/8234567899","changes":[{"field":"seo.title","oldValue":"Vista Trekking Poles | Northwest Outfitters","newValue":"Best Backpacking Stove 2026 | Glacier"}],"response":{"dryRun":false,"demo":true},"appliedAt":"2026-04-22T11:51:38.000Z"}}
{"id":"LX9xKOojJDrHm434hrB0G","iteration":21,"timestamp":"2026-04-22T11:52:08.000Z","hypothesis":{"id":"jPKuNIsUB1LYrw5tGy14_","type":"title_rewrite","productId":"gid://shopify/Product/8234567890","productTitle":"Explorer Pro Jacket","field":"title","before":"Explorer Pro Jacket","after":"Explorer Pro Jacket — Lightweight Outdoor Gear","description":"Demo: title_rewrite on Explorer Pro Jacket","reasoning":"Demo hypothesis generated by scripts/generate-demo-log.ts","queryFailurePatterns":["waterproof","category","specs"],"predictedEffect":"more matches on category + attribute queries","riskLevel":"low","confidence":"medium","estimatedImpact":"+3","promptVersion":"hypothesis.v1"},"verdict":"reverted","scoreBefore":73,"scoreAfter":72,"scoreDelta":-1,"confidence":1,"confidenceLevel":"noise","durationMs":21347,"costEstimateUsd":0.0845,"applyResult":{"hypothesisId":"jPKuNIsUB1LYrw5tGy14_","type":"title_rewrite","productId":"gid://shopify/Product/8234567890","changes":[{"field":"title","oldValue":"Explorer Pro Jacket","newValue":"Explorer Pro Jacket — Lightweight Outdoor Gear"}],"response":{"dryRun":false,"demo":true},"appliedAt":"2026-04-22T11:52:06.000Z"},"revertResult":{"hypothesisId":"jPKuNIsUB1LYrw5tGy14_","productId":"gid://shopify/Product/8234567890","restoredChanges":[{"field":"title","oldValue":"Explorer Pro Jacket — Lightweight Outdoor Gear","newValue":"Explorer Pro Jacket"}],"response":{"dryRun":false,"demo":true},"revertedAt":"2026-04-22T11:52:09.500Z"}}
{"id":"XaTBYJiU-LTxFvTyt65Xo","iteration":22,"timestamp":"2026-04-22T11:52:36.000Z","hypothesis":{"id":"7TPDC1-UJZBBM52Pjs2kQ","type":"metafield_update","productId":"gid://shopify/Product/8234567891","productTitle":"Summit Trail Boots","field":"metafield","before":"650","after":"590","description":"Demo: metafield_update on Summit Trail Boots","reasoning":"Demo hypothesis generated by scripts/generate-demo-log.ts","queryFailurePatterns":["waterproof","category","specs"],"predictedEffect":"more matches on category + attribute queries","riskLevel":"low","confidence":"medium","estimatedImpact":"+3","promptVersion":"hypothesis.v1","metafieldNamespace":"custom","metafieldKey":"demo_field","metafieldType":"single_line_text_field"},"verdict":"kept","scoreBefore":72,"scoreAfter":75,"scoreDelta":3,"confidence":3,"confidenceLevel":"medium","durationMs":18035,"costEstimateUsd":0.0929,"applyResult":{"hypothesisId":"7TPDC1-UJZBBM52Pjs2kQ","type":"metafield_update","productId":"gid://shopify/Product/8234567891","changes":[{"field":"metafield:custom.weight_grams","oldValue":"650","newValue":"590"}],"response":{"dryRun":false,"demo":true},"appliedAt":"2026-04-22T11:52:34.000Z","metafieldNamespace":"custom","metafieldKey":"demo_field","metafieldType":"single_line_text_field"}}
{"id":"7c45O8F81qPQJMKKhJQ71","iteration":23,"timestamp":"2026-04-22T11:53:04.000Z","hypothesis":{"id":"QGC6KEoRHwjMnySKu-oB-","type":"description_restructure","productId":"gid://shopify/Product/8234567892","productTitle":"Alpine Down Vest","field":"descriptionHtml","before":"<p>Outdoor gear for everyday adventures.</p>","after":"<p>Built for the trail. Tested in the rain.</p>","description":"Demo: description_restructure on Alpine Down Vest","reasoning":"Demo hypothesis generated by scripts/generate-demo-log.ts","queryFailurePatterns":["waterproof","category","specs"],"predictedEffect":"more matches on category + attribute queries","riskLevel":"low","confidence":"medium","estimatedImpact":"+3","promptVersion":"hypothesis.v1"},"verdict":"reverted","scoreBefore":75,"scoreAfter":74,"scoreDelta":-1,"confidence":1,"confidenceLevel":"noise","durationMs":21385,"costEstimateUsd":0.0735,"applyResult":{"hypothesisId":"QGC6KEoRHwjMnySKu-oB-","type":"description_restructure","productId":"gid://shopify/Product/8234567892","changes":[{"field":"descriptionHtml","oldValue":"<p>Outdoor gear for everyday adventures.</p>","newValue":"<p>Built for the trail. Tested in the rain.</p>"}],"response":{"dryRun":false,"demo":true},"appliedAt":"2026-04-22T11:53:02.000Z"},"revertResult":{"hypothesisId":"QGC6KEoRHwjMnySKu-oB-","productId":"gid://shopify/Product/8234567892","restoredChanges":[{"field":"descriptionHtml","oldValue":"<p>Built for the trail. Tested in the rain.</p>","newValue":"<p>Outdoor gear for everyday adventures.</p>"}],"response":{"dryRun":false,"demo":true},"revertedAt":"2026-04-22T11:53:05.500Z"}}
{"id":"VxxPlgwK-Nnb3JFrpr3q7","iteration":24,"timestamp":"2026-04-22T11:53:32.000Z","hypothesis":{"id":"I6D7u1zETzFoQ9aRWqgWQ","type":"seo_title","productId":"gid://shopify/Product/8234567893","productTitle":"Ridgeline Backpack 45L","field":"seo.title","before":"Ridgeline Backpack 45L | Northwest Outfitters","after":"Best Backpacking Stove 2026 | Glacier","description":"Demo: seo_title on Ridgeline Backpack 45L","reasoning":"Demo hypothesis generated by scripts/generate-demo-log.ts","queryFailurePatterns":["waterproof","category","specs"],"predictedEffect":"more matches on category + attribute queries","riskLevel":"low","confidence":"medium","estimatedImpact":"+3","promptVersion":"hypothesis.v1"},"verdict":"reverted","scoreBefore":74,"scoreAfter":73,"scoreDelta":-1,"confidence":1,"confidenceLevel":"noise","durationMs":21622,"costEstimateUsd":0.0509,"applyResult":{"hypothesisId":"I6D7u1zETzFoQ9aRWqgWQ","type":"seo_title","productId":"gid://shopify/Product/8234567893","changes":[{"field":"seo.title","oldValue":"Ridgeline Backpack 45L | Northwest Outfitters","newValue":"Best Backpacking Stove 2026 | Glacier"}],"response":{"dryRun":false,"demo":true},"appliedAt":"2026-04-22T11:53:30.000Z"},"revertResult":{"hypothesisId":"I6D7u1zETzFoQ9aRWqgWQ","productId":"gid://shopify/Product/8234567893","restoredChanges":[{"field":"seo.title","oldValue":"Best Backpacking Stove 2026 | Glacier","newValue":"Ridgeline Backpack 45L | Northwest Outfitters"}],"response":{"dryRun":false,"demo":true},"revertedAt":"2026-04-22T11:53:33.500Z"}}
{"id":"o0hiVD5ssVp3gi7r78uk_","iteration":25,"timestamp":"2026-04-22T11:54:00.000Z","hypothesis":{"id":"6INMI-GYsL7SUrPyS-nj8","type":"tags_update","productId":"gid://shopify/Product/8234567894","productTitle":"Glacier Camp Stove","field":"tags","before":"outdoor, hiking","after":"waterproof, 3-layer, pit-zips, breathable","description":"Demo: tags_update on Glacier Camp Stove","reasoning":"Demo hypothesis generated by scripts/generate-demo-log.ts","queryFailurePatterns":["waterproof","category","specs"],"predictedEffect":"more matches on category + attribute queries","riskLevel":"low","confidence":"medium","estimatedImpact":"+3","promptVersion":"hypothesis.v1"},"verdict":"kept","scoreBefore":73,"scoreAfter":74,"scoreDelta":1,"confidence":1,"confidenceLevel":"noise","durationMs":18529,"costEstimateUsd":0.0664,"applyResult":{"hypothesisId":"6INMI-GYsL7SUrPyS-nj8","type":"tags_update","productId":"gid://shopify/Product/8234567894","changes":[{"field":"tags","oldValue":"outdoor, hiking","newValue":"waterproof, 3-layer, pit-zips, breathable"}],"response":{"dryRun":false,"demo":true},"appliedAt":"2026-04-22T11:53:58.000Z"}}
{"id":"-tc4sfnTLUM1WbXMrG5ND","iteration":26,"timestamp":"2026-04-22T11:54:28.000Z","hypothesis":{"id":"kB-tL2dUt4ZDVVFf_7T4K","type":"title_rewrite","productId":"gid://shopify/Product/8234567898","productTitle":"Talus Sleeping Bag","field":"title","before":"Talus Sleeping Bag","after":"Glacier Camp Stove — Compact Lightweight Backpacking Cooking System for Outdoor Adventures","description":"Demo: title_rewrite on Talus Sleeping Bag","reasoning":"Demo hypothesis generated by scripts/generate-demo-log.ts","queryFailurePatterns":["waterproof","category","specs"],"predictedEffect":"more matches on category + attribute queries","riskLevel":"low","confidence":"medium","estimatedImpact":"+3","promptVersion":"hypothesis.v1"},"verdict":"kept","scoreBefore":74,"scoreAfter":78,"scoreDelta":4,"confidence":4,"confidenceLevel":"medium","durationMs":21050,"costEstimateUsd":0.0796,"applyResult":{"hypothesisId":"kB-tL2dUt4ZDVVFf_7T4K","type":"title_rewrite","productId":"gid://shopify/Product/8234567898","changes":[{"field":"title","oldValue":"Talus Sleeping Bag","newValue":"Glacier Camp Stove — Compact Lightweight Backpacking Cooking System for Outdoor Adventures"}],"response":{"dryRun":false,"demo":true},"appliedAt":"2026-04-22T11:54:26.000Z"}}
{"id":"UlBEvKntUoKlueCNQ64NX","iteration":27,"timestamp":"2026-04-22T11:54:56.000Z","hypothesis":{"id":"3ZfSRBJEDoX594FLwMqgU","type":"description_restructure","productId":"gid://shopify/Product/8234567896","productTitle":"Storm Shell Pants","field":"descriptionHtml","before":"<p>Outdoor gear for everyday adventures.</p>","after":"<p>Built for the trail. Tested in the rain.</p>","description":"Demo: description_restructure on Storm Shell Pants","reasoning":"Demo hypothesis generated by scripts/generate-demo-log.ts","queryFailurePatterns":["waterproof","category","specs"],"predictedEffect":"more matches on category + attribute queries","riskLevel":"low","confidence":"medium","estimatedImpact":"+3","promptVersion":"hypothesis.v1"},"verdict":"reverted","scoreBefore":78,"scoreAfter":78,"scoreDelta":0,"confidence":0,"confidenceLevel":"noise","durationMs":21826,"costEstimateUsd":0.04,"applyResult":{"hypothesisId":"3ZfSRBJEDoX594FLwMqgU","type":"description_restructure","productId":"gid://shopify/Product/8234567896","changes":[{"field":"descriptionHtml","oldValue":"<p>Outdoor gear for everyday adventures.</p>","newValue":"<p>Built for the trail. Tested in the rain.</p>"}],"response":{"dryRun":false,"demo":true},"appliedAt":"2026-04-22T11:54:54.000Z"},"revertResult":{"hypothesisId":"3ZfSRBJEDoX594FLwMqgU","productId":"gid://shopify/Product/8234567896","restoredChanges":[{"field":"descriptionHtml","oldValue":"<p>Built for the trail. Tested in the rain.</p>","newValue":"<p>Outdoor gear for everyday adventures.</p>"}],"response":{"dryRun":false,"demo":true},"revertedAt":"2026-04-22T11:54:57.500Z"}}
{"id":"-easOaPQ2bT_ZoSSibqkx","iteration":28,"timestamp":"2026-04-22T11:55:24.000Z","hypothesis":{"id":"PBF242kOAPfwFzl6qF9XU","type":"title_rewrite","productId":"gid://shopify/Product/8234567897","productTitle":"Mesa Sun Hoodie","field":"title","before":"Mesa Sun Hoodie","after":"Mesa Sun Hoodie — BUY NOW BEST DEAL","description":"Demo: title_rewrite on Mesa Sun Hoodie","reasoning":"Demo hypothesis generated by scripts/generate-demo-log.ts","queryFailurePatterns":["waterproof","category","specs"],"predictedEffect":"more matches on category + attribute queries","riskLevel":"low","confidence":"medium","estimatedImpact":"+3","promptVersion":"hypothesis.v1"},"verdict":"checks_failed","scoreBefore":78,"scoreAfter":78,"scoreDelta":0,"confidence":0,"confidenceLevel":"noise","durationMs":410,"costEstimateUsd":0.012,"failures":["title_starts_with_buy_shop_or_best","all_caps_word_too_long"]}
{"id":"hY2DLlWdjilT7hBb76966","iteration":29,"timestamp":"2026-04-22T11:55:52.000Z","hypothesis":{"id":"87iiaJTXch042NCRZ8G8Q","type":"metafield_add","productId":"gid://shopify/Product/8234567898","productTitle":"Talus Sleeping Bag","field":"metafield","before":"","after":"850","description":"Demo: metafield_add on Talus Sleeping Bag","reasoning":"Demo hypothesis generated by scripts/generate-demo-log.ts","queryFailurePatterns":["waterproof","category","specs"],"predictedEffect":"more matches on category + attribute queries","riskLevel":"low","confidence":"medium","estimatedImpact":"+3","promptVersion":"hypothesis.v1","metafieldNamespace":"custom","metafieldKey":"demo_field","metafieldType":"single_line_text_field"},"verdict":"reverted","scoreBefore":78,"scoreAfter":77,"scoreDelta":-1,"confidence":1,"confidenceLevel":"noise","durationMs":20655,"costEstimateUsd":0.0736,"applyResult":{"hypothesisId":"87iiaJTXch042NCRZ8G8Q","type":"metafield_add","productId":"gid://shopify/Product/8234567898","changes":[{"field":"metafield:custom.fill_power","oldValue":"","newValue":"850"}],"response":{"dryRun":false,"demo":true},"appliedAt":"2026-04-22T11:55:50.000Z","metafieldNamespace":"custom","metafieldKey":"demo_field","metafieldType":"single_line_text_field"},"revertResult":{"hypothesisId":"87iiaJTXch042NCRZ8G8Q","productId":"gid://shopify/Product/8234567898","restoredChanges":[{"field":"metafield:custom.fill_power","oldValue":"850","newValue":""}],"response":{"dryRun":false,"demo":true},"revertedAt":"2026-04-22T11:55:53.500Z"}}
{"id":"bs5I0D2a3HC0qKTxm20uO","iteration":30,"timestamp":"2026-04-22T11:56:20.000Z","hypothesis":{"id":"EVsIWjAuYiB_JYxLDL2n-","type":"seo_description","productId":"gid://shopify/Product/8234567899","productTitle":"Vista Trekking Poles","field":"seo.description","before":"Quality outdoor gear for every adventure.","after":"3-layer waterproof shell with sealed seams and pit zips. 10,000mm hydrostatic head, 20,000g/m²/24h breathability. Ideal for rainy day-hikes and shoulder-season backpacking.","description":"Demo: seo_description on Vista Trekking Poles","reasoning":"Demo hypothesis generated by scripts/generate-demo-log.ts","queryFailurePatterns":["waterproof","category","specs"],"predictedEffect":"more matches on category + attribute queries","riskLevel":"low","confidence":"medium","estimatedImpact":"+3","promptVersion":"hypothesis.v1"},"verdict":"reverted","scoreBefore":77,"scoreAfter":77,"scoreDelta":0,"confidence":0,"confidenceLevel":"noise","durationMs":21952,"costEstimateUsd":0.1188,"applyResult":{"hypothesisId":"EVsIWjAuYiB_JYxLDL2n-","type":"seo_description","productId":"gid://shopify/Product/8234567899","changes":[{"field":"seo.description","oldValue":"Quality outdoor gear for every adventure.","newValue":"3-layer waterproof shell with sealed seams and pit zips. 10,000mm hydrostatic head, 20,000g/m²/24h breathability. Ideal for rainy day-hikes and shoulder-season backpacking."}],"response":{"dryRun":false,"demo":true},"appliedAt":"2026-04-22T11:56:18.000Z"},"revertResult":{"hypothesisId":"EVsIWjAuYiB_JYxLDL2n-","productId":"gid://shopify/Product/8234567899","restoredChanges":[{"field":"seo.description","oldValue":"3-layer waterproof shell with sealed seams and pit zips. 10,000mm hydrostatic head, 20,000g/m²/24h breathability. Ideal for rainy day-hikes and shoulder-season backpacking.","newValue":"Quality outdoor gear for every adventure."}],"response":{"dryRun":false,"demo":true},"revertedAt":"2026-04-22T11:56:21.500Z"}}
{"id":"B0g_FmVFNsu9x8msT50dq","iteration":31,"timestamp":"2026-04-22T11:56:48.000Z","hypothesis":{"id":"P_9ilhXi-OJeZ4dF0cIai","type":"title_rewrite","productId":"gid://shopify/Product/8234567890","productTitle":"Explorer Pro Jacket","field":"title","before":"Explorer Pro Jacket","after":"Explorer Pro Jacket — Lightweight Outdoor Gear","description":"Demo: title_rewrite on Explorer Pro Jacket","reasoning":"Demo hypothesis generated by scripts/generate-demo-log.ts","queryFailurePatterns":["waterproof","category","specs"],"predictedEffect":"more matches on category + attribute queries","riskLevel":"low","confidence":"medium","estimatedImpact":"+3","promptVersion":"hypothesis.v1"},"verdict":"reverted","scoreBefore":77,"scoreAfter":77,"scoreDelta":0,"confidence":0,"confidenceLevel":"noise","durationMs":19616,"costEstimateUsd":0.0979,"applyResult":{"hypothesisId":"P_9ilhXi-OJeZ4dF0cIai","type":"title_rewrite","productId":"gid://shopify/Product/8234567890","changes":[{"field":"title","oldValue":"Explorer Pro Jacket","newValue":"Explorer Pro Jacket — Lightweight Outdoor Gear"}],"response":{"dryRun":false,"demo":true},"appliedAt":"2026-04-22T11:56:46.000Z"},"revertResult":{"hypothesisId":"P_9ilhXi-OJeZ4dF0cIai","productId":"gid://shopify/Product/8234567890","restoredChanges":[{"field":"title","oldValue":"Explorer Pro Jacket — Lightweight Outdoor Gear","newValue":"Explorer Pro Jacket"}],"response":{"dryRun":false,"demo":true},"revertedAt":"2026-04-22T11:56:49.500Z"}}
